<?xml version="1.0" encoding="UTF-8" ?><!--
装备编码规则
前两位代表装备类型 05 武器 01上衣 ...
第三位代表类型  050 太刀 010布甲上衣
之后三位表示装备等级
最后两位表示顺序号
例如: 05009000 圣耀救赎太刀
-->
<equipments xmlns="http://www.w3school.com.cn"
            xmlns:xsi="http://www.w3.org/2001/XMLSchema-instance"
            xsi:schemaLocation="http://www.w3school.com.cn equipment.xsd">
    <weapon>
        <swordman>
            <equipment id='0002178'>
                <Name>苍穹落幕太刀</Name>
                <Grade>epic</Grade>
                <Type>太刀</Type>
                <Level>95</Level>
                <Property>
                    <PhyAtta>1112</PhyAtta>
                    <MagAtta>1230</MagAtta>
                    <IndAtta>723</IndAtta>
                    <Strength>78</Strength>
                    <Intelligence>117</Intelligence>
                    <PhyCrit>2</PhyCrit>
                    <SkillAtta>45</SkillAtta>
                    <AllDamage>30</AllDamage>
                    <PropertyAtta>5</PropertyAtta>
                </Property>
            </equipment>
            <equipment id='0002191'>
                <Name>黑暗之主太刀</Name>
                <Grade>epic</Grade>
                <Type>太刀</Type>
                <Level>95</Level>
                <Property>
                    <PhyAtta>1112</PhyAtta>
                    <MagAtta>1230</MagAtta>
                    <IndAtta>723</IndAtta>
                    <Strength>78</Strength>
                    <Intelligence>117</Intelligence>
                    <PhyCrit>2</PhyCrit>
                    <SkillAtta>55</SkillAtta>
                    <AllDamage>32</AllDamage>
                    <PropertyAtta>5</PropertyAtta>
                </Property>
            </equipment>
            <equipment id='0002199' editable="true">
                <Name>太极天帝剑</Name>
                <Grade>epic</Grade>
                <Type>太刀</Type>
                <Level>100</Level>
                <Property>
                    <PhyAtta>1167</PhyAtta>
                    <MagAtta>1290</MagAtta>
                    <IndAtta>770</IndAtta>
                    <Strength>81</Strength>
                    <Intelligence>122</Intelligence>
                    <PhyCrit>2</PhyCrit>
                    <SkillAtta>30</SkillAtta>
                    <TriAttaPercent>40</TriAttaPercent>
                    <StrengthIntelligencePercent>10</StrengthIntelligencePercent>
                    <Edit>
                        <Selection index="0" default="0" title="阴气/阳气:">
                            <Option value="0" title="阴气:">
                                <AllDamage>21</AllDamage>
                            </Option>
                            <Option value="1" title="阳气:">
                                <SkillAtta>23</SkillAtta>
                            </Option>
                        </Selection>
                    </Edit>
                </Property>
            </equipment>
            <equipment id='0002181'>
                <Name>前瞻守卫者</Name>
                <Grade>epic</Grade>
                <Type>太刀</Type>
                <Level>100</Level>
                <Property>
                    <PhyAtta>1167</PhyAtta>
                    <MagAtta>1290</MagAtta>
                    <IndAtta>770</IndAtta>
                    <Strength>81</Strength>
                    <Intelligence>122</Intelligence>
                    <PhyCrit>2</PhyCrit>
                    <SkillAtta>35</SkillAtta>
                    <StrengthIntelligencePercent>25</StrengthIntelligencePercent>
                    <ExtraYellow>14</ExtraYellow>
                    <ExtraCrit>26</ExtraCrit>
                </Property>
            </equipment>
            <equipment id='0004166'>
                <Name>苍穹落幕短剑</Name>
                <Grade>epic</Grade>
                <Type>短剑</Type>
                <Level>95</Level>
                <Property>
                    <PhyAtta>1112</PhyAtta>
                    <MagAtta>1346</MagAtta>
                    <IndAtta>723</IndAtta>
                    <Intelligence>78</Intelligence>
                    <MagCrit>2</MagCrit>
                    <SkillAtta>45</SkillAtta>
                    <AllDamage>30</AllDamage>
                    <PropertyAtta>5</PropertyAtta>
                </Property>
            </equipment>
            <equipment id='0004174'>
                <Name>黑暗之主短剑</Name>
                <Grade>epic</Grade>
                <Type>短剑</Type>
                <Level>95</Level>
                <Property>
                    <PhyAtta>1112</PhyAtta>
                    <MagAtta>1346</MagAtta>
                    <IndAtta>723</IndAtta>
                    <Intelligence>78</Intelligence>
                    <MagCrit>2</MagCrit>
                    <SkillAtta>55</SkillAtta>
                    <AllDamage>32</AllDamage>
                    <PropertyAtta>5</PropertyAtta>
                </Property>
            </equipment>
            <equipment id='0004182'>
                <Name>信念徽章:自由</Name>
                <Grade>epic</Grade>
                <Type>短剑</Type>
                <Level>100</Level>
                <Property>
                    <PhyAtta>1167</PhyAtta>
                    <MagAtta>1414</MagAtta>
                    <IndAtta>770</IndAtta>
                    <Strength>81</Strength>
                    <MagCrit>2</MagCrit>
                    <SkillAtta>30</SkillAtta>
                    <StrengthIntelligencePercent>26</StrengthIntelligencePercent>
                    <TriAttaPercent>22</TriAttaPercent>
                    <ExtraYellow>22</ExtraYellow>
                </Property>
            </equipment>
            <equipment id='0004169'>
                <Name>战场的热血:安格巴迪</Name>
                <Grade>epic</Grade>
                <Type>短剑</Type>
                <Level>100</Level>
                <Property>
                    <PhyAtta>1167</PhyAtta>
                    <MagAtta>1414</MagAtta>
                    <IndAtta>770</IndAtta>
                    <Strength>81</Strength>
                    <PropertyAtta>0</PropertyAtta>
                    <MagCrit>2</MagCrit>
                    <SkillAtta>40</SkillAtta>
                    <ExtraCrit>30</ExtraCrit>
                    <ExtraYellow>34</ExtraYellow>
                </Property>
            </equipment>
        </swordman>
    </weapon>
    <armor>
        <shoulder>
            <!--95级-->
            <equipment id='0100071' suit="0001">
                <Name>超界·苍天之碧:卷云</Name>
                <Grade>epic</Grade>
                <Type>布甲</Type>
                <Level>95</Level>
                <Property>
                    <AllDamage>5</AllDamage>
                    <SkillAtta>20</SkillAtta>
                </Property>
            </equipment>
            <equipment id='0101068' suit="0003">
                <Name>超界·雨水:长青的群山</Name>
                <Grade>epic</Grade>
                <Type>皮甲</Type>
                <Level>95</Level>
                <Property>
                    <SkillLevel type="range" start="1" end="45" condition="全部">1</SkillLevel>
                    <White>20</White>
                </Property>
            </equipment>
            <equipment id='0102071' suit="0005">
                <Name>超界·北极星的魅力</Name>
                <Grade>epic</Grade>
                <Type>轻甲</Type>
                <Level>95</Level>
                <Property>
                    <PhyCrit>12</PhyCrit>
                    <MagCrit>12</MagCrit>
                    <SkillAtta>18</SkillAtta>
                </Property>
            </equipment>
            <equipment id='0103071' suit="0007">
                <Name>超界·梵雅的绝世容颜</Name>
                <Grade>epic</Grade>
                <Type>重甲</Type>
                <Level>95</Level>
                <Property>
                    <SkillAtta>23</SkillAtta>
                </Property>
            </equipment>
            <equipment id='0104069' suit="0009">
                <Name>超界·君清石的思念</Name>
                <Grade>epic</Grade>
                <Type>板甲</Type>
                <Level>95</Level>
                <Property>
                    <FireStrengthen>20</FireStrengthen>
                    <SkillAtta>17</SkillAtta>
                </Property>
            </equipment>
            <!--100级-->
            <!--布甲-->
            <equipment id='0100080' suit="0016">
                <Name>大祭司的星祈披肩</Name>
                <Grade>epic</Grade>
                <Type>布甲</Type>
                <Level>100</Level>
                <Property>
                    <StrengthIntelligencePercent>10</StrengthIntelligencePercent>
                    <TriAttaPercent>10</TriAttaPercent>
                    <SkillAtta>12</SkillAtta>
                </Property>
            </equipment>
            <equipment id='0100081' suit="0017">
                <Name>魔法师[???]的披风</Name>
                <Grade>epic</Grade>
                <Type>布甲</Type>
                <Level>100</Level>
                <Property>
                    <SkillAtta>13</SkillAtta>
                    <TriAttaPercent>10</TriAttaPercent>
                    <StrengthIntelligencePercent>5</StrengthIntelligencePercent>
                    <PhyCrit>5</PhyCrit>
                    <MagCrit>5</MagCrit>
                </Property>
            </equipment>
            <equipment id='0100082' suit="0018">
                <Name>性感洒脱探戈</Name>
                <Grade>epic</Grade>
                <Type>布甲</Type>
                <Level>100</Level>
                <Property>
                    <White>17</White>
                    <SkillAtta>14</SkillAtta>
                    <Cd type="range" start="75" end="80">-15</Cd>
                </Property>
            </equipment>
            <!--皮甲-->
            <equipment id='0101076' suit="0019">
                <Name>死亡阴影护肩</Name>
                <Grade>epic</Grade>
                <Type>皮甲</Type>
                <Level>100</Level>
                <Property>
                    <ExtraCrit>18</ExtraCrit>
                    <SkillAtta>10</SkillAtta>